"Story","Title","Result","Date","Stability","Duration (s)"
"Account recon","Refresh accounts","SUCCESS","2023-02-21T16:57:13.356+08:00[Asia/Shanghai]","0.0","101.72"
"Annual statistical budget","Create annual statistical entry","SUCCESS","2023-02-21T16:58:56.076+08:00[Asia/Shanghai]","0.0","60.18"
"Batch posting","Batch posting voiding process","SUCCESS","2023-02-21T16:59:57.265+08:00[Asia/Shanghai]","0.0","149.71"
"Batch posting","Batch posting general ledger entry","SUCCESS","2023-02-21T17:02:27.776+08:00[Asia/Shanghai]","0.0","131.55"
"General ledger entries","Create general ledger entry","SUCCESS","2023-02-21T17:06:24.25+08:00[Asia/Shanghai]","0.0","138.35"
"Internal transfer","Create internal transfer entry","SUCCESS","2023-02-21T17:11:53.284+08:00[Asia/Shanghai]","0.0","90.43"
"Monthly statistical entries","Create monthly statistical entry","SUCCESS","2023-02-21T17:13:24.771+08:00[Asia/Shanghai]","0.0","60.33"
"Salary advance","Create salary advance entry","SUCCESS","2023-02-21T17:14:26.08+08:00[Asia/Shanghai]","0.0","98.02"
"Working advance","Create working advance entry","SUCCESS","2023-02-21T17:16:05.129+08:00[Asia/Shanghai]","0.0","97.15"
